{
  "name": "united-states-historical-house-prices",
  "title": "United states historical house prices",
  "resources": [
    {
      "path": "archive/source.xls",
      "pathType": "local",
      "name": "source",
      "format": "xls",
      "mediatype": "application/vnd.ms-excel",
      "encoding": "windows-1252"
    },
    {
      "path": "data/united_states_historical_house_prices.csv",
      "pathType": "local",
      "name": "united_states_historical_house_prices",
      "format": "csv",
      "mediatype": "text/csv",
      "encoding": "ISO-8859-1",
      "dialect": {
        "delimiter": ",",
        "quoteChar": "\""
      },
      "schema": {
        "fields": [
          {
            "name": "Date",
            "type": "string",
            "format": "default"
          },
          {
            "name": "Real Home Price Index",
            "type": "number",
            "format": "default"
          },
          {
            "name": "Real Building Cost Index",
            "type": "number",
            "format": "default"
          },
          {
            "name": "U.S. Population Millions",
            "type": "number",
            "format": "default"
          },
          {
            "name": "Long Rate",
            "type": "number",
            "format": "default"
          },
          {
            "name": "Long Rate Source",
            "type": "string",
            "format": "default"
          },
          {
            "name": "Nominal Home Price Index From_fig2.1Revised2011.xls",
            "type": "number",
            "format": "default"
          },
          {
            "name": "HPI Source",
            "type": "string",
            "format": "default"
          },
          {
            "name": "Nominal Building Cost Index",
            "type": "string",
            "format": "default"
          },
          {
            "name": "Build Cost Source",
            "type": "string",
            "format": "default"
          },
          {
            "name": "Consumer Price Index",
            "type": "number",
            "format": "default"
          },
          {
            "name": "CPI Annual & Quarterly",
            "type": "string",
            "format": "default"
          },
          {
            "name": "CPI Annual",
            "type": "number",
            "format": "default"
          }
        ],
        "missingValues": [
          ""
        ]
      }
    },
    {
      "path": "scripts/dataset-curator.py",
      "pathType": "local",
      "name": "dataset-curator",
      "format": "py",
      "encoding": "ISO-8859-1"
    }
  ],
  "readme": "The prices in the files are the prices of houses and buidling and this version of the figure has quarterly data from 1953-I for prices, all other data are annual.\n\n## Data\n\nDataset contains U.S houses prices starting from 1890 to 2014's quarter. \n\nThe data is fetched from [Department of Economics, Yale University](https://economics.yale.edu/) under their [data](http://www.econ.yale.edu/~shiller/data.htm) portal which states that they are showing home prices since 1890 and is available for download and updated monthly: [US Home Prices 1890-Present](http://www.econ.yale.edu/~shiller/data/Fig3-1.xls).\n\nDataset contains following fields:\n\n* \"Date\" representing year of which prices belong to.\n* \"Real Home Price Index\" showing a house price index, which measures the price changes of residential housing as a percentage change from some specific start date.\n* \"Real Building Cost Index\" showing a building price index, which measures the price changes of building as a percentage change from some specific start date.\n* \"U.S. Population Millions\" showing the population of United States in millions.\n* \"Long Rate\" showing the rate of interest borne.\n* \"Long Rate Source\" showing the source of Long Rate.\n* \"Nominal Home Price Index From_fig2.1Revised2011.xls\" is shpwing nominal HPI from the fig2 in the source.xls file.\n* \"HPI Source\" showing the source of the home price index.\n* \"Nominal Building Cost Index\" showing the nominal buidling price index \n* \"Build Cost Source\" showing the source where the BCI come from.\n* \"Consumer Price Index\" showing measures changes in the price level of a weighted average market of consumer and services purchased.\n* \"CPI Annual & Quarterly\" showing the Consumer Price Index Annualy & quarterly.\n* \"CPI Annual\" showing the Consumer Price Index Annualy\n\n## Preparation\n\nTo update the data run the process script locally:\n```bash\npython scripts/dataset-curator.py\n```\n\nSeveral steps will be done to get the final data.\n\n* It first hits the URL and download the XLS file to the archive directory\n* It applies parsing on a sheet named 'Data' in the downloaded file.\n* After cleaning and parsing, final output is genertated in a CSV file that is contained under 'data' directory and is named 'united_states_historical_house_prices.csv'.\n\n## License\n\nThe data collection effort about investor attitudes that [Robert J. Shiller](http://www.econ.yale.edu/~shiller/bio.htm) have been conducting since 1989 has now resulted in a group of Stock Market Confidence Indexes produced by the Yale School of Management. These data are collected in collaboration with Fumiko Kon-Ya and Yoshiro Tsutsui of Japan. Some of our earlier results are also noteworthy: [Results of Surveys about Stock Market Speculation 12/99](http://www.econ.yale.edu/~shiller/data/investor.html).\n\nHistorical housing market data used in book, Irrational Exuberance [Princeton University Press 2000, Broadway Books 2001, 2nd edition, 2005], showing home prices since 1890 are available for download and updated monthly.",
  "description": "The prices in the files are the prices of houses and buidling and this version of the figure has qua",
  "licenses": [
    {
      "name": "ODC-PDDL",
      "path": "http://opendatacommons.org/licenses/pddl/",
      "title": "Open Data Commons Public Domain Dedication and License"
    }
  ]
}